<?xml version='1.0'?>
<!DOCTYPE interface SYSTEM "interface.dtd">

<interface name="ElMamun" interactive="on" lib="std" design="color">

<versioninfo>
(C) 2006 Fredo Schmidt
all rights reserved
</versioninfo>

<interactive>
<message>
_____             _                    _  _  _  _   _____________________
||    |   |\\  /| |_| |\\  /| | | |\\ |   _|| || || |  Elmamun 3000:
||__  |__ | \\/ | | | | \\/ | |_| | \\|   _||_||_||_|  Based on the arithm.  
||--                                                standards of 864 a.d
||      Version: 24.2.2006                          Report bugs to: 
-----                                               elmamun@acm.org

Welcome to ElMamun!
</message>
<commandline>ElMamun> </commandline>
</interactive>

<module name="seller" source="ElMamun.lhs" 
    adpc="-al seller enum -cs seller -alpp prettyprint -O -lcf -ta bto -bt so -gc cc  -cto -tadd 3 -taddc 30  | sed -f ElMamun_seller.sed  > ElMamun_seller.c "
    condition="opt->switch_seller"
    output_optimal="printf($Optimal result: #d\\nSuboptimal results in range [#d - #d]\\n$, result_score, result_score - traceback_diff, result_score);"
    output_suboptimal="printf($Score: #d -> #s \\n$, v2, result_prettyprint);"
    main_name="main_elmamun_seller"></module>

<module name="buyer" source="ElMamun.lhs" 
    adpc="-al buyer enum -cs buyer -alpp prettyprint -O -lcf -ta bto -bt so -gc cc  -cto -tadd 3 -taddc 30  | sed -f ElMamun_buyer.sed  > ElMamun_buyer.c "
    condition="opt->switch_buyer"
    output_optimal="printf($Optimal result: #d\\nSuboptimal results in range [#d - #d]\\n$, result_score, result_score - traceback_diff, result_score);"
    output_suboptimal="printf($Score: #d -> #s \\n$, v2, result_prettyprint);"
    main_name="main_elmamun_buyer"></module>


  
  <option switch="h" text="Hilf mir! Was soll ich machen?">
    <help />
    <man>

     Elmamun verwendet aktuellste Technologien. Drücke -h, und du bekommst eine Übersicht über die 
     Möglichkeiten von ElMamun. Wenn Du -H und dazu eine Option angibst, bekommst Du sogar noch etwas mehr Infos
     
    </man>

  </option>

  <option switch="H" argtext="option" text="Display detailed information on <option>">
    <longhelp />
  </option>
  
  <option switch="v" text="Show version">

   <version />
<man>ElMamun wird ständig weiterentwickelt und an die aktuellsten
   Ergebnisse der mathematischen Forschung angepasst. Drücke -v um zu
   erfahrfen wie alt deine Version ist. Falls zu alt, dann wende dich
   bitte an deine örtliche Niederlassung von ElMamun Inc. Vielleicht
   haben wir eine neue Version. Ob die besser ist, wissen wir allerdings
   nicht. </man> 
 </option>


  <option switch="s" text="Choose seller mode.">
   <mode var="switch_seller"
         settext="Switch to mode seller."
         infotext="Algebra: seller" />

   <man>
Dies ist der optimale Modus für Verkäufer. Einfach die Formel
eingeben, und ihr bekommt die optimale Klammerung. So werden Geschäfte
gemacht, hehe!

Kleiner Tipp: Mit der Option -d könnt ihr Ihr Euch auch ein paar
alternative Egebnisse anschauen. Der Verkaufspreis steht jeweils
links. Da gibt es dann vielleicht ein bisschen weniger, aber besser
irgendein Geschäft als überhaupt kein Geschäft, woll?
 
   </man>

</option>

<option switch="b" text="Choose buyer mode.">
   <mode var="switch_buyer"
         settext="Switch to mode buyer."
         infotext="Algebra: buyer" />
   <man>
ElMamun supports various modi of calculation.  If you want to buy
something, you probably don't want to pay to much. ElMamun offers the
most current calculations for these tasks. 

Our analysis showed that our algorithm in many cases gives good
results for buyers. However, a proof is still open.
   </man>

</option>



  <option switch="d" text="Set traceback diff">
     <set var="traceback_diff" datatype="int" default="5" minval="0" infotext="backtrace_value: #d"
            settext="set backtrace value to #d"/>
  </option>

  
  <option switch="f" text="Read input from file">
    <file />
  </option>
  
  <option switch="z" text="Enable colored output">
    <switch var="colored_output" />
  <code>
  if (opt->interactive && !opt->colored_output) printf(COLOR_DEFAULT);
  </code>
  </option>

</interface>
